{
  "$schema": "http://json-schema.org/draft-07/schema#",
  "$id": "https://op4z.dev/substrate/schemas/config.schema.json",
  "title": "Substrate Project Configuration",
  "description": "Schema for `substrate.config.json` at the consumer repo root. Mirrors the runtime SubstrateConfig type. Additive: v2 fields (e.g. memory.path) are optional so older configs continue to validate.",
  "type": "object",
  "required": ["version", "project", "stacks", "paths", "defaults", "bridges", "telemetry"],
  "additionalProperties": true,
  "properties": {
    "$schema": {
      "type": "string"
    },
    "version": {
      "description": "Substrate config schema version this file was written against.",
      "type": "string"
    },
    "project": {
      "type": "object",
      "required": ["name"],
      "additionalProperties": true,
      "properties": {
        "name": { "type": "string" },
        "shortName": { "type": "string" },
        "shortCode": { "type": "string" },
        "description": { "type": "string" }
      }
    },
    "stacks": {
      "type": "array",
      "items": { "type": "string" }
    },
    "paths": {
      "type": "object",
      "required": ["auto"],
      "additionalProperties": true,
      "properties": {
        "backend": { "type": "string" },
        "frontend": { "type": "string" },
        "packagesTs": { "type": "string" },
        "packagesPython": { "type": "string" },
        "docs": { "type": "string" },
        "auto": { "type": "string" }
      }
    },
    "defaults": {
      "type": "object",
      "required": ["audits", "standards", "scaffolds", "workflows"],
      "additionalProperties": true,
      "properties": {
        "audits": { "type": "array", "items": { "type": "string" } },
        "standards": { "type": "array", "items": { "type": "string" } },
        "scaffolds": { "type": "array", "items": { "type": "string" } },
        "workflows": { "type": "array", "items": { "type": "string" } }
      }
    },
    "bridges": {
      "type": "object",
      "additionalProperties": true
    },
    "knowledge": {
      "type": "object",
      "additionalProperties": true,
      "properties": {
        "sources": { "type": "array", "items": { "type": "string" } },
        "redactPatterns": { "type": "array", "items": { "type": "string" } }
      }
    },
    "extensions": {
      "type": "object",
      "additionalProperties": true,
      "properties": {
        "taskAdapter": { "type": ["string", "null"] },
        "vcsAdapter": { "type": ["string", "null"] }
      }
    },
    "telemetry": {
      "type": "object",
      "required": ["enabled"],
      "additionalProperties": true,
      "properties": {
        "enabled": { "type": "boolean" }
      }
    },
    "memory": {
      "description": "v2.0 memory subsystem configuration. Optional; when omitted, substrate falls back to $SUBSTRATE_MEMORY_PATH then Claude Code's default directory (~/.claude/projects/<encoded>/memory/). See plan §6.1.",
      "type": "object",
      "additionalProperties": false,
      "properties": {
        "path": {
          "description": "Absolute or repo-relative path to the memory store directory. Memories are expected to be `*.md` files with optional YAML frontmatter; see plan §6.2 for the extended frontmatter shape.",
          "type": "string",
          "minLength": 1
        }
      }
    },
    "extends": {
      "description": "v3.0 org-scoped content composition (NE-11). Each entry declares an upstream substrate-content source. The resolver walks each source's substrate/ tree and merges per-kind. Repo-local content always wins on collision. Entries are evaluated in order: earlier entries are the base; later entries override earlier; the repo's own substrate/ overrides all. See substrate-phase-1-2-enterprise-plan.md §2.",
      "type": "array",
      "items": {
        "type": "object",
        "required": ["source"],
        "additionalProperties": false,
        "properties": {
          "source": {
            "description": "Source URL. One of: 'npm:<pkg-name>' (resolved via node_modules), 'github:<org>/<repo>' (cloned to substrate/.cache/extends/), or 'file:<relative-path>' (live filesystem reference).",
            "type": "string",
            "minLength": 1,
            "pattern": "^(npm:[@A-Za-z0-9][@A-Za-z0-9_./\\-]*|github:[A-Za-z0-9][A-Za-z0-9_.\\-]*/[A-Za-z0-9][A-Za-z0-9_.\\-]*|file:.+)$"
          },
          "version": {
            "description": "Optional npm semver range. Only meaningful for 'npm:' sources; ignored otherwise. Defaults to whatever the consumer's node_modules has installed.",
            "type": "string",
            "minLength": 1
          },
          "ref": {
            "description": "Optional git ref (tag, branch, or commit SHA). Only meaningful for 'github:' sources; ignored otherwise. Defaults to the source repo's default branch (resolved at clone time).",
            "type": "string",
            "minLength": 1
          }
        }
      }
    },
    "extends-opt-out": {
      "description": "v3.0.0-beta.1 (plan §2.4): consumer-level opt-out for selected extends sources. Each string must match the exact `source` URL of an entry in `extends`. Matching sources are suppressed from the chain at resolve time — their content does NOT merge into the effective registry. Useful when an org-shared source contains content that's not applicable to a particular repo (e.g. a backend service repo opting out of frontend rules) without forking the org-shared package. Bypass with `substrate extends list --include-opt-out` for diagnostics.",
      "type": "array",
      "items": {
        "type": "string",
        "minLength": 1
      }
    }
  }
}
